[{"stage_result_schema":"ev4-architect-stage-result@1.0.0","run_id":"run-quality-first-001","stage_id":"/intake","stage_version":"1.0.0","stage_status":"pass","blocking_issues":[],"carried_unknowns":[{"unknown_id":"U-mobile-behavior","statement":"Mobile connector treatment requires evidence.","status":"active","evidence_refs":[]}],"quality_checks":{"intake_complete":"pass"},"next_stage":"/research","research_disposition":null,"decision_state":{"recommendation_made":false,"hidden_recommendation":false,"unknown_converted_to_exact":false,"selected_candidate_id":null,"selected_candidate_locked":false,"build_tree_digest":null,"implementation_tree_digest":null,"architecture_drift":false},"runtime_context":{"anchor_present":false,"validation_bundle_present":false,"independent_regeneration_executed":false,"validation_profile_status":"blocked_missing_semantics","exact_head_ci_available":false,"pr_review_available":false,"repository_maintenance_required":false},"final_audit_findings":[],"project_gate_export":null},{"stage_result_schema":"ev4-architect-stage-result@1.0.0","run_id":"run-quality-first-001","stage_id":"/research","stage_version":"1.0.0","stage_status":"pass","blocking_issues":[],"carried_unknowns":[{"unknown_id":"U-mobile-behavior","statement":"Mobile connector treatment requires evidence.","status":"active","evidence_refs":[]}],"quality_checks":{"research_scope_resolved":"pass"},"next_stage":"/decompose","research_disposition":"no_platform_question","decision_state":{"recommendation_made":false,"hidden_recommendation":false,"unknown_converted_to_exact":false,"selected_candidate_id":null,"selected_candidate_locked":false,"build_tree_digest":null,"implementation_tree_digest":null,"architecture_drift":false},"runtime_context":{"anchor_present":false,"validation_bundle_present":false,"independent_regeneration_executed":false,"validation_profile_status":"blocked_missing_semantics","exact_head_ci_available":false,"pr_review_available":false,"repository_maintenance_required":false},"final_audit_findings":[],"project_gate_export":null},{"stage_result_schema":"ev4-architect-stage-result@1.0.0","run_id":"run-quality-first-001","stage_id":"/decompose","stage_version":"1.0.0","stage_status":"pass","blocking_issues":[],"carried_unknowns":[{"unknown_id":"U-mobile-behavior","statement":"Mobile connector treatment requires evidence.","status":"active","evidence_refs":[]}],"quality_checks":{"observation_inference_separated":"pass"},"next_stage":"/architectures","research_disposition":null,"decision_state":{"recommendation_made":false,"hidden_recommendation":false,"unknown_converted_to_exact":false,"selected_candidate_id":null,"selected_candidate_locked":false,"build_tree_digest":null,"implementation_tree_digest":null,"architecture_drift":false},"runtime_context":{"anchor_present":false,"validation_bundle_present":false,"independent_regeneration_executed":false,"validation_profile_status":"full_transaction_implemented","exact_head_ci_available":false,"pr_review_available":false,"repository_maintenance_required":false},"final_audit_findings":[],"project_gate_export":null},{"stage_result_schema":"ev4-architect-stage-result@1.0.0","run_id":"run-quality-first-001","stage_id":"/architectures","stage_version":"1.1.0","stage_status":"pass","blocking_issues":[],"carried_unknowns":[{"unknown_id":"U-mobile-behavior","statement":"Mobile connector treatment requires evidence.","status":"active","evidence_refs":[]}],"quality_checks":{"architecture_coverage_complete":"pass"},"next_stage":"/score-evidence","research_disposition":null,"decision_state":{"recommendation_made":false,"hidden_recommendation":false,"unknown_converted_to_exact":false,"selected_candidate_id":null,"selected_candidate_locked":false,"build_tree_digest":null,"implementation_tree_digest":null,"architecture_drift":false},"runtime_context":{"anchor_present":false,"validation_bundle_present":false,"independent_regeneration_executed":false,"validation_profile_status":"full_transaction_implemented","exact_head_ci_available":false,"pr_review_available":false,"repository_maintenance_required":false},"final_audit_findings":[],"project_gate_export":null},{"stage_result_schema":"ev4-architect-stage-result@1.0.0","run_id":"run-quality-first-001","stage_id":"/score-evidence","stage_version":"1.3.0","stage_status":"pass","blocking_issues":[],"carried_unknowns":[{"unknown_id":"U-mobile-behavior","statement":"Mobile connector treatment requires evidence.","status":"resolved_with_evidence","evidence_refs":["user:mobile-behavior-confirmation"]}],"quality_checks":{"evidence_scoring_valid":"pass"},"next_stage":"/score-audit","research_disposition":null,"decision_state":{"recommendation_made":false,"hidden_recommendation":false,"unknown_converted_to_exact":false,"selected_candidate_id":null,"selected_candidate_locked":false,"build_tree_digest":null,"implementation_tree_digest":null,"architecture_drift":false},"runtime_context":{"anchor_present":false,"validation_bundle_present":false,"independent_regeneration_executed":false,"validation_profile_status":"full_transaction_implemented","exact_head_ci_available":false,"pr_review_available":false,"repository_maintenance_required":false},"final_audit_findings":[],"project_gate_export":null},{"stage_result_schema":"ev4-architect-stage-result@1.0.0","run_id":"run-quality-first-001","stage_id":"/score-audit","stage_version":"1.2.0","stage_status":"pass","blocking_issues":[],"carried_unknowns":[],"quality_checks":{"score_audit_acceptance":"pass"},"next_stage":"/recommend","research_disposition":null,"decision_state":{"recommendation_made":false,"hidden_recommendation":false,"unknown_converted_to_exact":false,"selected_candidate_id":null,"selected_candidate_locked":false,"build_tree_digest":null,"implementation_tree_digest":null,"architecture_drift":false},"runtime_context":{"anchor_present":false,"validation_bundle_present":false,"independent_regeneration_executed":false,"validation_profile_status":"full_transaction_implemented","exact_head_ci_available":false,"pr_review_available":false,"repository_maintenance_required":false},"final_audit_findings":[],"project_gate_export":null},{"stage_result_schema":"ev4-architect-stage-result@1.0.0","run_id":"run-quality-first-001","stage_id":"/recommend","stage_version":"1.1.0","stage_status":"pass","blocking_issues":[],"carried_unknowns":[],"quality_checks":{"candidate_lock_valid":"pass"},"next_stage":"/build-tree","research_disposition":null,"decision_state":{"recommendation_made":true,"hidden_recommendation":false,"unknown_converted_to_exact":false,"selected_candidate_id":"A07","selected_candidate_locked":true,"build_tree_digest":null,"implementation_tree_digest":null,"architecture_drift":false},"runtime_context":{"anchor_present":false,"validation_bundle_present":false,"independent_regeneration_executed":false,"validation_profile_status":"blocked_missing_semantics","exact_head_ci_available":false,"pr_review_available":false,"repository_maintenance_required":false},"final_audit_findings":[],"project_gate_export":null},{"stage_result_schema":"ev4-architect-stage-result@1.0.0","run_id":"run-quality-first-001","stage_id":"/build-tree","stage_version":"1.0.0","stage_status":"pass","blocking_issues":[],"carried_unknowns":[],"quality_checks":{"build_tree_fidelity":"pass"},"next_stage":"/implementation","research_disposition":null,"decision_state":{"recommendation_made":true,"hidden_recommendation":false,"unknown_converted_to_exact":false,"selected_candidate_id":"A07","selected_candidate_locked":true,"build_tree_digest":"sha256:aaaaaaaaaaaaaaaaaaaaaaaaaaaaaaaaaaaaaaaaaaaaaaaaaaaaaaaaaaaaaaaa","implementation_tree_digest":null,"architecture_drift":false},"runtime_context":{"anchor_present":false,"validation_bundle_present":false,"independent_regeneration_executed":false,"validation_profile_status":"blocked_missing_semantics","exact_head_ci_available":false,"pr_review_available":false,"repository_maintenance_required":false},"final_audit_findings":[],"project_gate_export":null},{"stage_result_schema":"ev4-architect-stage-result@1.0.0","run_id":"run-quality-first-001","stage_id":"/implementation","stage_version":"1.0.1","stage_status":"pass","blocking_issues":[],"carried_unknowns":[],"quality_checks":{"implementation_fidelity":"pass"},"next_stage":"/final-audit","research_disposition":null,"decision_state":{"recommendation_made":true,"hidden_recommendation":false,"unknown_converted_to_exact":false,"selected_candidate_id":"A07","selected_candidate_locked":true,"build_tree_digest":"sha256:aaaaaaaaaaaaaaaaaaaaaaaaaaaaaaaaaaaaaaaaaaaaaaaaaaaaaaaaaaaaaaaa","implementation_tree_digest":"sha256:aaaaaaaaaaaaaaaaaaaaaaaaaaaaaaaaaaaaaaaaaaaaaaaaaaaaaaaaaaaaaaaa","architecture_drift":false},"runtime_context":{"anchor_present":false,"validation_bundle_present":false,"independent_regeneration_executed":false,"validation_profile_status":"blocked_missing_semantics","exact_head_ci_available":false,"pr_review_available":false,"repository_maintenance_required":false},"final_audit_findings":[],"project_gate_export":null},{"stage_result_schema":"ev4-architect-stage-result@1.0.0","run_id":"run-quality-first-001","stage_id":"/final-audit","stage_version":"1.0.1","stage_status":"pass","blocking_issues":[],"carried_unknowns":[],"quality_checks":{"final_audit_acceptance":"pass"},"next_stage":"/handoff-export","research_disposition":null,"decision_state":{"recommendation_made":true,"hidden_recommendation":false,"unknown_converted_to_exact":false,"selected_candidate_id":"A07","selected_candidate_locked":true,"build_tree_digest":"sha256:aaaaaaaaaaaaaaaaaaaaaaaaaaaaaaaaaaaaaaaaaaaaaaaaaaaaaaaaaaaaaaaa","implementation_tree_digest":"sha256:aaaaaaaaaaaaaaaaaaaaaaaaaaaaaaaaaaaaaaaaaaaaaaaaaaaaaaaaaaaaaaaa","architecture_drift":false},"runtime_context":{"anchor_present":false,"validation_bundle_present":false,"independent_regeneration_executed":false,"validation_profile_status":"blocked_missing_semantics","exact_head_ci_available":false,"pr_review